{
  "case_id": "RET-000123",
  "languages": [
    "it",
    "en"
  ],
  "path": "withdrawal",
  "evidence_quality": "sufficient",
  "quadrant": "Q4",
  "levers": [
    {
      "id": "return_window_days",
      "value": 14,
      "scope": "future_orders"
    },
    {
      "id": "free_return_shipping",
      "value": false,
      "scope": "future_orders"
    },
    {
      "id": "instant_refund",
      "value": false,
      "scope": "future_orders"
    },
    {
      "id": "coupons_enabled",
      "value": false,
      "scope": "future_orders"
    },
    {
      "id": "cluster_coupons_disabled",
      "value": true,
      "scope": "future_orders_cluster"
    },
    {
      "id": "transparency_notice",
      "value": true,
      "scope": "communication"
    }
  ],
  "placeholders": {
    "available": [
      "terms",
      "deadline"
    ],
    "required": [
      "terms"
    ]
  },
  "facts": [
    {
      "id": "F1",
      "entity": "customer",
      "metric": "risk_score",
      "value": 0.87,
      "period": "as of 2026-10-14",
      "nature": "synthetic"
    },
    {
      "id": "F2",
      "entity": "customer",
      "metric": "value_eur_12m",
      "value": 42.1,
      "period": "12 months to 2026-10-14",
      "nature": "synthetic"
    },
    {
      "id": "F3",
      "entity": "cluster",
      "metric": "cluster_welcome_coupons",
      "value": 7,
      "period": "as of 2026-10-14",
      "nature": "synthetic"
    },
    {
      "id": "F4",
      "entity": "cluster",
      "metric": "cluster_size",
      "value": 7,
      "period": "as of 2026-10-14",
      "nature": "synthetic"
    },
    {
      "id": "F5",
      "entity": "return",
      "metric": "days_since_delivery",
      "value": 6,
      "period": "2026-10-08/2026-10-14",
      "nature": "synthetic"
    }
  ],
  "risk": {
    "score": 0.87,
    "top_factors": [
      {
        "feature": "cluster_welcome_coupons",
        "value": 7,
        "phrase": "7 linked accounts each used the welcome coupon"
      }
    ]
  },
  "value_eur": 42.1,
  "cluster": {
    "id": "R-MARCO",
    "size": 7,
    "shared": [
      "device",
      "address",
      "card"
    ]
  },
  "policy_text": "Navigli Fashion return policy (demo).",
  "customer_text": "<customer_text>Non mi sta bene.</customer_text>"
}
